industry,heading,category1,category2,category3,category4,category5,default_sentence
金融（除く銀行） ,リスク管理に関する事項,気候関連リスク,コンプライアンスリスク,リスク管理委員会,リスク最小化の方針,その他,"当社は、サステナビリティに対する取り組みを進化させると同時に、さまざまなリスクに対応する堅牢なリスク管理体制を構築しております。事業活動に伴うリスクとチャンスの両面から、経営の持続可能性を向上させることを目指し、環境変化に迅速かつ柔軟に対応する戦略を進化させています。2025年までに新規投資案件の90%以上でサステナビリティリスク評価を完了する「Green Project Initiative」を推進し、環境と社会に対するポジティブ・インパクトの最大化を図ります。

気候関連リスクにおいては、業界をリードする低炭素ビジネスモデルの確立に向け、2030年までにCO2排出量を100%削減する目標を設定した「NCM（Non Co2 Movement）」を推進しています。気候変動による物理的リスクの評価には、地球温暖化防止策に貢献する投資の拡大や、天然災害からの資産保護を目的としたインフラ計画の策定を含む「Resilient Blueprint」を実行しております。また、適応コストや緩和策の投資については、エネルギー革新技術への10億ドル規模のリサーチ＆デベロップメント組み入れを実施しており、気候変動への戦略的対応を図っています。

コンプライアンスリスクに関しては、国際的な規制変更に敏感に反応し、対応策の検討および実施を行う「Global Compliance Framework」を設けております。当該フレームワークにより、幅広い規制への遵守だけでなく、最新の業界標準やベストプラクティスの採用を通じ、業務プロセスの最適化を図るとともに、コンプライアンス文化の浸透を促進しています。特に、データ保護やサイバーセキュリティ関連の規制に対する合わせて、年間継続教育を全社員に義務づけるなど、社内の意識向上にも力を入れております。

リスク管理委員会においては、CEOを委員長とし、CFOやCOOをはじめとした各部門のエグゼクティブたちが定期的に会合を開催、リスク管理戦略のレビューと評価を実施しています。この委員会では、具体的かつ経済的価値に対するリスクの特定、評価、そして軽減策の決定に加えて、企業ガバナンスの強化と透明性の確保を主要な任務と位置づけ、ステークホルダーへの信頼確立を進めております。委員会による最近の功績としては、災害復旧プランの強化や、戦略的パートナーシップによるリスク分散の促進が挙げられます。

リスク最小化の方針に関しては、全社的なリスクアセスメント手法の標準化とともに、弊社独自の「Adaptive Risk Matrix」を利用し、事業ごとに最も影響を受けやすいリスクを特定し、それぞれの事業計画に組み込んでいくというアプローチを採用しています。これにより、リスクの事前検知能力の向上と迅速なリアクションを実現することで、企業価値の保全および増大を目指します。また、投資判断においては、将来の社会・環境変化を反映させたリスク調整後リターンを重視し、長期的な持続可能性と利益最大化を両立させております。

その他には、サプライチェーン全体のサステナビリティ向上を図るため、「Sustainable Supply Chain Initiative（SSCI）」を推進しております。これは、供給業者の環境配慮や社会的責任を評価し、改善を促すことで、全体としてのリスクを低減し、品質と信頼性の向上を実現する取り組みです。すでに当該イニシアチブ励起後、深刻な供給網リスクが20%削減される成果を見せており、引き続き監査・評価の徹底と提携企業の持続可能な経済活動への移行支援を行ってまいります。"
建設・資材 ,リスク管理に関する事項,気候関連リスク,コンプライアンスリスク,リスク管理委員会,リスク最小化の方針,その他,"当社は、建設・資材業界特有のリスク管理とサステナビリティ向上に注力しています。これは、市場の変動性、環境への配慮、法令順守の必須性、そして社会的責任の全うに貢献するためです。特に、環境保護と資源の有効活用は私たちの業務において重要な要素であり、持続可能性の確保と利益の最大化を両立させるための経営戦略を取り入れています。

気候関連リスクにおいては、当社は環境的持続可能性を踏まえた戦略的な対応を実施しています。具体的には、2030年までにCO2排出量を現在のレベルから50%削減することを目標とした「クリーン・コンストラクション・チャレンジ（CCC）」を推進し、当社の全建設プロジェクトで使用される資材および機器の総エネルギー消費量の最適化を図っています。さらに、リサイクル可能な建材の利用率を80%まで引き上げることで、廃棄物の削減と資源循環を目指しています。

コンプライアンスリスクに関しては、法規制の厳格化とともに、私たちの業務遂行における法的要件への遵守を徹底しています。これを支えるために「コンプライアンス・エクセレンス・プログラム（CEP）」が立ち上げられ、新たに制定される建設業界の法規制や国際基準に迅速に適応し、違反リスクの排除を目指しております。このプログラムには、当社の建設現場における労働安全基準の徹底や、サプライヤーとの取引に関わる調達ガイドラインの厳守も含まれています。

リスク管理委員会においては、定期的な会合を通じてリスクの早期発見と分析を行なっています。当委員会では、経済的リスクから環境リスク、技術的リスクまで、その受容範囲を定め、予防的な対策を策定しています。また、女性の管理職率を2025年までに30%まで引き上げることで、組織内の多様性と柔軟性を高めるための「ダイバーシティ・アドバンスメント・プラン（DAP）」を実施しており、これによりリスクへの対応力の向上を図っています。

リスク最小化の方針に関しては、全社員がリスク意識を持つことを目標に、継続的な教育と訓練を実施しています。これにより、技術革新や市場の動向、環境変化に迅速かつ適切に対応するための「アジャイル・リスク・アダプテーション・イニシアティブ（ARAI）」を展開しております。ARAIプログラムは、プロジェクトマネージメントの効率化と事故発生防止を重視しています。

その他には、地域社会との連携を深める取り組みを積極的に進めております。地元企業やNPOと協力し、子供たちの建設業界体験プログラムを実施することで、将来の人材育成にも寄与しています。同時に、地域の経済発展や雇用創出への貢献を目指して、「ローカル・パートナーシップ・ディベロップメント・プログラム（LPDP）」を立ち上げることで、地域社会への貢献と当社のビジネス成長を同時に促進しています。これらの多角的なリスク管理手法とサステナビリティへの取り組みにより、当社は業界内での競争力を維持し、持続可能な成長を実現する基盤を築いているのです。"
銀行 ,リスク管理に関する事項,気候関連リスク,コンプライアンスリスク,リスク管理委員会,リスク最小化の方針,その他,"当社は、サステナビリティに焦点を当てたリスク管理プロセスを通じて、継続可能な企業成長と社会的責任を両立させることに尽力しております。そのために、環境、社会、企業統治（ESG）の各指標に基づく包括的なリスクアセスメントを実施し、将来的なビジネス影響を予測し評価することで、企業価値の維持・向上を図っております。

気候関連リスクにおいては、温暖化の進行が企業活動に与える潜在的影響を重視しています。とりわけ、運用資産におけるカーボンフットプリントの把握を徹底し、2030年までに二酸化炭素排出量を2020年比で50%削減することを目標としております。さらに、当社はNCM（Non Co2 Movement）に基づき、エネルギー効率化と再生可能エネルギーへの投資拡大により、2050年を目処に完全なカーボンニュートラルを実現する計画を立てており、これに伴い、当該リスクのヘッジ戦略を策定しています。

コンプライアンスリスクに関しては、金融規制の変化が頻繁で複雑なため、他業種に比べてリスクの露出が高くなる傾向があります。そのため、当社は法令順守を確実に行うために、「クリアバンク・コンダクト・フレームワーク（CBCF）」を導入し、高度なリスク識別・対応システムを運用しています。内部の規制遵守体制の強化を積極的に推進する一環として、2021年には全従業員を対象としたコンプライアンス研修の受講率を99.8%まで向上させるなどの成果を挙げております。

リスク管理委員会においては、多角的な視点からリスク評価および緩和策の策定を行っております。委員会では、7名のメンバー（内3名が外部独立専門家）による定期的な会合を通じて、戦略的リスクマネジメントプロセスの見直しと強化を行い、当社のビジネス展開地における政治的変動や経済環境の変化に迅速に対応できる体制を整えています。2022年度は、主にコロナ後の経済回復期における市場変動リスクのモニタリングを強化しました。

リスク最小化の方針に関しては、事業の多様性を高めて単一市場への依存を避け、リスク分散を促進しています。特に、地域金融の将来性に注目し、アジア太平洋地域への貸出ポートフォリオをこれまでの10%から15%に拡大するとともに、リテールバンキング部門では、女性の管理職率を現在の15%から2025年までに25%に引き上げることを目標に掲げています。これにより、組織のダイバーシティと包摂性の向上を図りつつ、異なる視点からのリスク評価と対応策の発展を期待しています。

その他には、サイバーセキュリティリスクへの対応として、「デジタルシールド計画」を立ち上げました。これにより、最新のセキュリティ技術に基づいた防御体制を確立し、顧客情報および企業情報の保護に全力を尽くしています。また、資本レベルでは、強靭な財務基盤の維持に努め、不測の事態にも迅速かつ柔軟に対応できるように、一定の流動性リザーブを厳格に管理しております。これらの取り組みを通じ、当社はあらゆる外部環境変化においても安定した事業運営を維持し、ステークホルダーの皆様に安心をお届けできるように努めております。"
商社・卸売 ,リスク管理に関する事項,気候関連リスク,コンプライアンスリスク,リスク管理委員会,リスク最小化の方針,その他,"当社は、持続可能な経営を実現するため、様々なリスク管理戦略を策定し、精緻なリスク評価と効果的な対策の実施に注力しています。商社・卸売業の特性から、商品の調達、物流、市場動向の変化等、多岐にわたる要因がビジネス活動に関わるため、広範囲なリスク管理体制を構築し、日々の意思決定に反映しています。

気候関連リスクにおいては、地球温暖化の進行がもたらす長期的な市場への影響について注視しています。私たちは2030年までにCO2排出量を現状から50％削減し、2050年には完全に排出量ゼロとすることを目指す「NCM（Non CO2 Movement）」プロジェクトを推進しており、再生可能エネルギーを用いた物流手段の導入、環境に配慮したパッケージ材の使用などを進めることで、これを実現しています。また、サプライチェーン全体の環境負荷を減少させることを目指し、供給者に対しても環境管理のガイドラインを設け、共に取り組む協働体制を築いています。

コンプライアンスリスクに関しては、国内外の法規制の変更、特に輸出入に関連する規制に敏感に対応する必要があります。そのため、国際貿易法専門の法務チームを設置し、最新の法改正情報を常時監視する体制を整えています。このチームは、定期的に全従業員を対象としたコンプライアンス研修を実施し、法令順守と倫理観の高い企業文化の醸成に努めています。

リスク管理委員会においては、代表取締役を中心とした役員と業界専門家で構成され、月に一度の頻度でリスク状況の評価と対策の策定を行っております。この委員会は、市場動向、天候変動、サイバーセキュリティなどの各種リスク要因に対し、具体的なリスク評価指標を用いて分析し、緊急時の対応計画を含めたリスクマネジメントポリシーの定期的な見直しを行っています。

リスク最小化の方針に関しては、女性の管理職率を現在の15％から2025年までには25％に引き上げることを目標としています。これにより、リーダーシップ層の多様性と視点の拡充を図り、新たな市場ニーズへの対応力を高め、経営のリスク分散を推進しています。また、当社はデータ駆動型経営を推進し、リアルタイムでの市場データ分析に基づく迅速な意思決定を実現するシステム「DMAS（Dynamic Market Analysis System）」を導入しています。

その他には、事業の多角化を進めることで一つの市場や商品に依存するリスクを抑えつつ、各事業領域においてリム・リージョンズ・インサイトプロジェクト（LRIP）を展開し、地域特有の市場動向や文化を深く理解し、それぞれの地域に適した商品開発とサービス提供を強化しています。現実に即したリスク管理を通じて、当社はサステナビリティを核とした堅実な成長を目指します。"
自動車・輸送機 ,リスク管理に関する事項,気候関連リスク,コンプライアンスリスク,リスク管理委員会,リスク最小化の方針,その他,"当社は、持続可能性を経営戦略の中核と位置づけ、継続的な企業価値の創造と環境及び社会への貢献を着実に進めております。私たちは、自動車業界のリーダーとして、環境変化や市場ニーズに迅速に対応し、リスクを機会へと転換する能力を高めながら、企業の持続可能性を追求しています。

気候関連リスクにおいては、地球温暖化の影響による経済活動へのリスクが顕著になっています。当社では、2030年までに温室効果ガス排出量を物流活動を含め現行比で40%削減し、さらに2050年には当社の生産活動におけるCO2排出量を100%削減する目標の「NCM (Non CO2 Movement)」を推進しています。このために、脱炭素に向けた研究開発やリサイクルシステムの導入、低炭素のエネルギーへの転換、そして電動車両の開発・販売を進める等、具体的な対策を実施しています。

コンプライアンスリスクに関しては、国内外の法規制遵守を最優先とし、特に排ガス規制や安全基準を見越して、厳格な自己評価システムを設置し、常時監査を行っております。また、エンジニアリングチームはこれらの規制に適合する新しい車両デザインの開発に精力的に取り組んでおり、毎年、投資予算の約20%を研究開発に充てています。技術革新が進む中、車両の自動運転技術のさらなる向上にも注力しており、法規制や社会基準の変化に迅速かつ柔軟に対応できる体制を構築しています。

リスク管理委員会においては、各種リスクの評価と対策立案を行うため、定期的な会合を設けております。当委員会は、取締役会と直結しており、リスク管理の体制と情報の透明性を高めるため社長を含む経営陣、外部専門家を招聘しています。例えば、当社は製品の安全性を最優先に考え、品質管理部門と連携してリコールリスクを削減する取り組みに励んでおり、この戦略が広く評価されています。

リスク最小化の方針に関しては、全てのビジネスプロセスにおけるリスク識別、評価、対策の3ステップを遵守しています。具体的には、サプライチェーンマネジメントの強化を通じ、部品供給の遅延や停滞による生産停止リスクを低減させています。また、世界各国の市場状況や消費者トレンドの分析を行い、新しいモデルの開発や既存モデルの改善に活かしています。さらに、2025年までに女性の管理職率を30%に引上げる「Woman's Vision 2025」を策定し、経営層の多様性を確保して決定の質を高める施策を実施中です。

その他には、サイバーセキュリティリスクに対しても厳重な対策を講じています。当社は、顧客データの保護を最重要視し、外部のサイバーセキュリティの専門会社と協力し、最新の防衛技術を導入するとともに、全従業員に対するセキュリティ教育を徹底しています。これにより、データ侵害のリスクを最小限に抑えることができると考えています。当社のリスク管理体制は、市場の変化に対する柔軟性と同時に、堅牢さを持ち合わせており、経営陣からフロントラインまで、リスク意識が組織文化に深く根ざし、持続可能な成長を支えています。"
情報通信・サービスその他 ,リスク管理に関する事項,気候関連リスク,コンプライアンスリスク,リスク管理委員会,リスク最小化の方針,その他,"当社は、サステナビリティを企業戦略の中核に据え、リスクを積極的に管理し把握しながら、長期的な企業価値の向上と社会貢献を目指しています。環境、社会、ガバナンス（ESG）の各側面におけるリスクと機会を識別し、それらを効果的に管理することで、持続可能な成長を実現しています。

気候関連リスクにおいては、当社の情報通信サービス事業は特にデータセンターのエネルギー消費によるCO2排出量を減少させることが喫緊の課題であります。これに対応するため、2030年までにCO2排出量を100%削減することを目標とした「NCM（Non CO2 Movement）」を推進しており、既に2023年末時点で40%という削減を達成しています。再生可能エネルギーの利用拡大、高効率の冷却システムの導入、また最新の省エネルギー技術によるインフラ更新などを通じて、この目標の達成に全力を注いでいます。

コンプライアンスリスクに関しては、情報の管理や保護、プライバシーの尊重が当社事業の根幹をなす、非常に重要なファクターであると認識しています。このため、個々の従業員に対する定期的な法規制遵守研修、内部通報システムの整備、取締役会直轄のコンプライアンス委員会の設置など、コンプライアンス体制の強化に努めています。具体的な取り組みとしては、2022年度におけるデータ保護遵守率を99.8%に達成し、外部第三者機関によるコンプライアンス監査も毎年受けており、その結果は公表しています。

リスク管理委員会においては、様々なリスクを正確に評価、対応する体制を取っています。特に、当委員会では分科会を設け、環境リスク、社会リスク、ガバナンスリスクそれぞれ専門を持つメンバーにより詳細な議論を毎月行い、四半期ごとに取締役会へ報告することで透明性のある意思決定を支援しています。2023年度からは、リスク評価メトリクスを導入し、具体的な数値に基づくリスク評価・対策立案に取り組んでいます。

リスク最小化の方針に関しては、2025年までに女性の管理職率を30%に引き上げるという「Diversity Enhancement Plan」や、サービス提供過程で生じる社会的問題への対応を明らかにする「Service Responsibility Guidelines」の制定に力を入れています。これらの施策は、組織の多様性を受け入れることと、サービス提供の公正と倫理を重んじる姿勢を通じてリスクを軽減し、社会に対する信頼構築に繋がっています。

その他には、サプライチェーンのリスク管理強化のために、2024年度末までに全ての主要サプライヤーと「Sustainable Supply Chain Accord」を締結することを目標にしています。これにより、サプライヤー自身の環境保護や労働条件の向上が当社の事業にも好影響を及ぼし、最終的なサービス品質と顧客満足度の向上に寄与すると考えています。また、地域社会との連携を深める「Community Partnership Program」により、事業が直面する可能性のある社会的リスクへの理解とその対処を強化しています。"
