industry,heading,category1,category2,category3,category4,category5,default_sentence
商社・卸売 ,指標・目標に関する事項,多様性に関する目標,社内環境整備に関する目標,気候変動対策に関する目標,コーポレートガバナンスに関する目標,その他,"当社は、持続可能な成長を経営戦略の根幹に位置付け、サプライチェーンを通じた環境への配慮と社会貢献を強化するため「Futurist Green Initiative 2035」を策定しました。この戦略の下、当社は具体的な目標と数値目標を設けており、エシカルな商品取り扱いの拡大、省資源・低炭素物流の推進、および多様性と包括性のある労働環境の構築に注力しています。

多様性に関する目標においては、女性を含む多様なバックグラウンドを持つ人材の活躍を促進しており、女性の管理職比率を現在の15%から2025年までに30%へ向上させる計画「Leadership Diversity 2025」を展開中です。この目標達成のため、積極的な採用、メンタリングプログラムの拡充、ワークライフバランスの充実を進めており、女性の能力開花とキャリアアップを支援する環境を整備しています。

社内環境整備に関する目標に関しては、電力消費の削減と再生可能エネルギーの利用拡大を図る「Clean Energy Plan 2030」を実施しており、本社ビルおよび国内全拠点における自然エネルギー利用率を2025年までに50%に引き上げることを目指しています。加えて、従業員の健康促進と社内コミュニケーションの活性化を目的とした「Wellness & Engagement Program」を導入し、メンタルヘルスサポートやフィットネス設備の提供を通じて、従業員が健やかに働ける環境を追求しています。

気候変動対策に関する目標においては、取り扱い商品のライフサイクル全体を通じてCO2排出量を削減する「NCM（Non CO2 Movement）」策を実施し、2030年までにCO2排出量を2018年比で70％削減、2050年までにネットゼロを実現することを目標としています。これを実現するために、商品開発から廃棄までのプロセスにおいてエコフレンドリーな選択肢を提供し、サプライヤーと協働して責任ある調達を徹底しています。

コーポレートガバナンスに関する目標に関しては、「Transparent Management 2025」をスローガンに掲げ、ステークホルダーとの対話を重視した経営を追及しています。これにより、取締役会の多様性および独立性の更なる向上、情報開示の透明性の担保、ならびにリスクマネジメント体制の強化を図っております。当社の規模と業界を反映した専門家を取締役に迎え、多角的な視点から企業統治の充実を目指しております。

その他には、地域社会への貢献として2022年に開始した「Next-Gen Support Program」をさらなる規模拡大を計ることで、若年層向けの教育・起業支援を中核的なCSR活動と位置付け、次世代育成に積極的に寄与することを目標としています。また、業界におけるリーダー企業としての役割を果たすべく、商品のトレーサビリティの向上、フェアトレードの推進、持続可能な包装材料の採用などに注力し、全てのビジネスプロセスにおいてサステナビリティを追求して参ります。"
自動車・輸送機 ,指標・目標に関する事項,多様性に関する目標,社内環境整備に関する目標,気候変動対策に関する目標,コーポレートガバナンスに関する目標,その他,"当社は、持続可能な成長と社会的責任を果たす企業として、サステナビリティに対する強い姿勢を示し、具体的な目標を設定し取り組んでいます。多様性に関する目標においては、女性や少数民族の管理職比率を大幅に向上させることを目指しており、2025年までに管理職層における女性比率を30%、少数民族比率を20%に引き上げる「ダイバーシティ・アドバンスメント2025」プログラムを実施中です。また、社内トレーニングプログラムやメンターシップを通じて、女性や少数民族のキャリアアップを積極的に支援しています。

社内環境整備に関する目標に関しては、従業員が快適かつ効率的に業務を行える環境を整え、生産性の向上を図ることを目指しています。具体的には、オフィスの再設計を行い、ナチュラルライトの利用増加やエルゴノミックな家具の導入を完了させ、2024年までに全従業員がリフレッシュルームやフィットネス施設を利用できるようにする「ワークプレイスイノベーション計画」を推進しています。

気候変動対策に関する目標においては、自動車・輸送業界として環境負荷の低減が最重要課題であります。2027年までに自動車の排出CO2量を50%削減し、2035年までに排出量ゼロを実現するために「NCM（Non Co2 Movement）」を推進しております。これには、排出ガスの少ないハイブリッド車や電気自動車（EV）への転換、工場の省エネ化、再生可能エネルギーの導入など、幅広い取り組みが含まれています。

コーポレートガバナンスに関する目標に関しては、透明性と公正性を高めることを中心に据えています。2023年度中に取締役会に2人以上の独立した外部監査人を新たに迎え入れるとともに、ESG（環境・社会・企業統治）関連の議題を監査する専任チームを設置し、「透明性向上イニシアティブ2023」を通じて定期的な報告と評価を行う体制を整えています。

その他には、社会貢献活動にも力を入れており、地域社会とのつながりを深めるために、2026年までに年間500万ドルを超える寄付を行う「コミュニティハーモニー計画」を展開しています。また、自動車安全教育プログラムを全国の学校で開催し、子どもたちへの交通安全意識の向上に寄与しています。これら一連の活動を通じて、企業価値の最大化を目指すとともに、地球環境や社会全体への貢献を目指しております。"
情報通信・サービスその他 ,指標・目標に関する事項,多様性に関する目標,社内環境整備に関する目標,気候変動対策に関する目標,コーポレートガバナンスに関する目標,その他,"当社は、情報通信・サービス業界において先駆的なサステナビリティの取り組みを行い、その達成度を透明に報告することに励んでいます。2019年に打ち出した「Green-IT 2025プラン」の下で、当社はエネルギー消費量の削減に注力し、2025年までに2015年比でデータセンターの消費電力量を30%削減する目標を掲げています。また、その過程で生じた省エネルギーのノウハウを他社へ提供することで、業界全体のカーボンフットプリントを圧縮することを目指しております。
多様性に関する目標においては、「Diversity 2022イニシアティブ」を通して、女性管理職率を20%まで引き上げることに成功しました。この目標を更に推進し、2030年までには女性管理職比率を30%にするという新たな目標「Empower Her 2030」を設定しています。さらに、当社では男女問わず柔軟な働き方ができる環境を整備し、ジェンダーバランスの良い職場作りにも注力しています。

社内環境整備に関する目標に関しては、「Employee First Initiative」と称するプログラムを導入し、従業員が安全かつ健康に働ける職場環境を提供します。これには、健康診断の実施率100%達成や、ストレスチェックシステムの全従業員への展開を含んでおり、職場のメンタルヘルスケアにも力を入れております。また、仕事と家庭の両立支援のために、フレキシブルタイムの導入や在宅勤務制度の拡大を図り、従業員の働きやすさ改善を図っています。

気候変動対策に関する目標においては、「NCM（Non Co2 Movement)」プロジェクトを前進させ、2030年までにCO2排出量を100%削減するという野心的な目標を掲げています。実現に向けて、再生可能エネルギーの導入、効率的なエネルギー管理システムの開発、社外でもクリーンエネルギーの利用促進を目指すパートナーシップ構築など、多角的なアプローチを進めております。

コーポレートガバナンスに関する目標に関しては、「Transparency 2030」プログラムを実施しており、経営の透明性および監視体制の強化に注力しています。これには、独立した監査委員会設置、取締役の独立性基準の厳格化、株主との定期的な対話促進などが含まれています。公正かつ透明な経営を通じて、株主の皆様だけでなく社会全体からの信頼を獲得し、持続可能な企業価値の向上を目指しています。

その他には、技術革新を活用した「Smart Society 2030」の推進を掲げ、AIやIoTを通じて社会課題の解決に努める目標を設定しています。AIによる省エネルギー管理、環境モニタリング、サービス産業における生産性の向上等の取り組みを推進し、人々の生活の質の向上と環境保全を目指す「サービス&イノベーション部門」を設立しました。当社はこれらの戦略の下、業界のリーダーとして責任を全うし、持続可能な未来に向けた努力を続けてまいります。"
小売 ,指標・目標に関する事項,多様性に関する目標,社内環境整備に関する目標,気候変動対策に関する目標,コーポレートガバナンスに関する目標,その他,"当社は、小売業としての社会的責任を自覚し、持続可能な事業運営を目指しております。これを実現するキーポイントは、サステナビリティの観点からの綿密な指標と目標の設定にあります。

多様性に関する目標においては、働きがいのある職場環境を実現するためにジェンダー平等を推進しています。具体的には、女性の管理職比率を現在の15%から2025年末までに30%に増やすことを目指しており、これを「Women in Retail Initiative」と名付けたプログラムにより支援しています。また、性別に限らず、国籍や社会的背景などの多様性も深く尊重し、多文化共生の推進を図っています。

社内環境整備に関する目標に関しては、従業員一人一人が健康で快適に働ける環境作りを心がけています。2024年までに全店舗とオフィスで健康経営優良法人認定を受けることを目標に、キャンペーン「Work Together, Health Together」を展開し、従業員の健康促進とメンタルヘルスケアに力を注いでいます。

気候変動対策に関する目標においては、当社は「Green Retail Challenge 2040」という野心的な計画のもと、2030年までにCO2排出量を50%削減し、2040年までに実質ゼロ達成を目標としています。具体的には、店舗のLED照明完全移行、省エネルギー型冷蔵システムへの転換、そしてサプライチェーン全体での低炭素物流の推進を行っています。さらに、再生可能エネルギーの自社利用比率を大幅に引き上げ、「NCM（Non CO2 Movement）」を通じて他小売業界への影響力を拡大して行きます。

コーポレートガバナンスに関する目標に関しては、透明性の高い経営を実現するため、ステークホルダーとのコミュニケーションを一層強化しています。「Trust and Responsibility Program」と名づけられたこの取り組みでは、年に2回のサステナビリティ報告を公開し、株主と顧客に対して成果と課題を明確に報告しています。さらに、取締役会の独立性を強化し、その一部として、外部の専門家による定期的なレビューを設けています。

その他には、地域社会への貢献でも目標を設定しています。2023年から地元の非営利団体と共同で食品ロス削減プロジェクト「Save to Serve」を開始し、廃棄予定だった商品を低価格で提供することで、地域社会の貧困緩和に寄与しつつ、環境に配慮する取り組みを強化しています。当社はまた、全国の店舗を通じて地元製造者の製品を積極的に取り揃え、それが「Local Connection Campaign」と呼ばれるイニシアティブの一環となっています。これにより、地域経済を促進し、サプライヤーとの強固なパートナーシップを築いています。

これらの具体的な指標と目標を設定することにより、当社は社会的課題への取り組みをビジネスの成長と並行して行い、そのプロセスを通じてステークホルダーからの信頼を獲得し、持続可能な将来への貢献を目指して参ります。"
運輸・物流 ,指標・目標に関する事項,多様性に関する目標,社内環境整備に関する目標,気候変動対策に関する目標,コーポレートガバナンスに関する目標,その他,"当社は、安全で持続可能な運輸・物流サービスの提供を通じて、社会的責任を果たし、持続可能な成長を目指しております。2025年までに物流輸送効率を15%向上させ、「エコロジックトランスポート」計画のもと、CO2排出係数を輸送キロメートルあたり0.5kgCO2以下に削減することを目標としています。また、再生可能エネルギーを供給エネルギーの30%に上昇させる「グリーンルート2030」というイニシアティブを策定し、実行に移しております。

多様性に関する目標においては、ジェンダー、年齢、国籍に関わらず多様な人材が活躍できる環境を整備するため、管理職における女性の割合を現在の12%から2025年までに25%へ引き上げ、男女問わず柔軟な働き方を可能にする「ワークライフバランスプログラム」を全社的に推進しています。さらに、社内国際交流プログラムを拡大し、海外拠点との人材交流も積極的に行うことで、グローバルな視野を持った人材育成を図ります。

社内環境整備に関する目標に関しては、次世代物流管理システムの導入を進め、2025年までに99%の配達ルートで最適化を図り、効率的な物流を実現することや、全従業員がストレスフリーで働ける環境を作るために、「サステナ・ワークプレイス」プロジェクトを2024年末までに完成させる計画です。このプロジェクトには、健康経営への取り組み強化や福利厚生プログラムの充実が含まれます。

気候変動対策に関する目標においては、「NCM（Non CO2 Movement）」戦略の下、2030年までにCO2排出量を50%削減し、2050年にはネットゼロを実現することを目指しております。このために、自社配送車の全面的な電気自動車（EV）化や、物流センターのエネルギー効率化、および太陽光発電設備の導入を加速させています。

コーポレートガバナンスに関する目標に関しては、適正な企業統治を実現するため、2023年より「ガバナンス・エクセレンス2025」プランを策定し、取締役会に外部取締役を半数以上配置するほか、全取締役の定期的なスキルアップと研修プログラムにより専門知識のアップデートを図ります。また、利害関係者からの意見を積極的に取り入れ、企業倫理と透明性の更なる向上を推進します。

その他には、デジタル技術の活用による配送トラッキングシステムの最適化、顧客の声に基づいたサービス改善、地域社会と連携した社会貢献活動を通じて、社会との共生や地域経済の発展に寄与することを目標に掲げております。具体的には、2025年までに顧客満足度を現行比5ポイント向上させる「サティスファクション・プラス」イニシアティブや、地域社会の若者向けに物流業界の魅力を伝えるインターンシッププログラムを年間100名規模で行う計画です。当社はこれらの目標をもとに、ステークホルダーの皆様との対話を重ね、運輸・物流業界の持続可能性と競争力の向上に貢献して参ります。"
不動産 ,指標・目標に関する事項,多様性に関する目標,社内環境整備に関する目標,気候変動対策に関する目標,コーポレートガバナンスに関する目標,その他,"当社は、サステナビリティを企業経営の中核に位置づけ、長期的な企業価値の向上と持続可能な社会の構築に貢献しています。実現のため、当社は2025年までに不動産物件の省エネ基準を「ECO+10スタンダード」として法定基準より10%以上優る性能を全ての新築物件にて達成する目標を掲げ、これにより、住宅および商業施設のエネルギー効率を計測し、エネルギー消費量の削減に向けて具体的な施策を実行しています。

多様性に関する目標においては、2028年までに女性の管理職比率を現在の12%から25%へと増加させる「ウィメンズプログレスイニシアティブ」を推進。このイニシアティブは、意識改革プログラムおよび女性リーダー育成プログラムを通じ、性別にとらわれないキャリア機会の拡大を図っています。また、育児休業後の復職率95%の実現も目標に定めており、柔軟な働き方の推進や研修サポート体制の充実に力を入れています。

社内環境整備に関する目標に関しては、従業員の健康と幸福を重視したオフィス環境の構築に注力。高品質な空気循环システムの整備と光と風通しを意識したオフィスデザインによって、従業員の生産性の向上を図るとともに、心理的な快適さを追求することで、ワークライフバランスの最適化を目指しています。

気候変動対策に関する目標においては、2030年までにCO2排出量を2020年比で50%削減し「NCM（Non Co2 Movement）」運動を推進しています。これを達成するべく、再生可能エネルギーへの移行、ビルの高断熱改修、エネルギーマネジメントシステムの導入など、脱炭素社会の実現に向けた様々な取り組みを行っており、この努力は投資家や顧客から高く評価されています。

コーポレートガバナンスに関する目標に関しては、全てのステークホルダーへの透明性の高い情報開示を行い、経営の健全性を保つことを最優先課題としています。取締役会の独立性を保障するため、独立社外取締役を3名から5名に拡大し、コンプライアンス体制の強化に努めています。リスク管理の強化を図り、不祥事の予防と迅速な問題解決に努める体制を整えることで、株主をはじめとするすべてのステークホルダーへの責任を果たします。

その他には、地域社会とも共生する企業として、地元企業とのパートナーシップを拡大し「グリーンコミュニティ・プロジェクト」を推進。このプロジェクトにより、地域固有の環境を守るための取り組みや社会貢献活動を展開し、地域経済の活性化にも貢献する計画です。また、2030年にはCSR活動の一環として、社員ボランティア実働時間を年間合計5000時間に達することを目指し、社会との接点を増やしながら社会全体へのポジティブな影響を目指しています。"
食品 ,指標・目標に関する事項,多様性に関する目標,社内環境整備に関する目標,気候変動対策に関する目標,コーポレートガバナンスに関する目標,その他,"当社は、食品産業のパイオニアとして、地球環境と社会の持続可能性に向けた具体的な取り組みを強化しています。2030年に向けた中長期計画「Sustainable Table 2030」を策定し、環境と健康への深い配慮を基軸としたビジネスを推進しております。本計画下での主要な指標と目標を以下に示します。

多様性に関する目標においては、当社は「Women's Leadership 2025」というプログラムを推進しており、女性の管理職率を現在の12%から2025年までに25%へ引き上げることを目指しています。これを実現するため、意識改革プログラムと並行して、女性リーダー育成のための研修制度やメンターシッププログラムを積極的に拡充してまいります。

社内環境整備に関する目標に関しては、「Green Office 2025」という取り組みを通じて、自社施設のエネルギー消費量を20%削減することを目標としています。これにより、節電・省エネルギー機器の導入やテレワークの促進など、働きやすく環境に優しいオフィス作りを行います。

気候変動対策に関する目標においては、「NCM (Non CO2 Movement)」と呼ばれる当社独自の取り組みを進めており、2025年までにCO2排出量を40%削減し、最終的に2030年までに100%削減することを目指しています。これを実現するために、再生可能エネルギーの導入拡大や食品生産プロセスにおける排出ガス低減技術の開発・導入を行います。

コーポレートガバナンスに関する目標に関しては、「Transparent Governance Initiative」と名付けられた戦略を進展させることで、経営の透明性と監督機能の強化を図ります。具体的には、独立社外取締役の比率を現在の30%から2025年までに50%へと増加させることを目標に掲げています。また、株主の声を経営に反映させるためのシステムを構築し、持続可能な経営をサポートします。

その他には、サステナブルな食品供給チェーンの確立を目指し、「Green Supply Chain Project」を進行中です。供給パートナーとの連携を強化し、原材料の20%をフェアトレードやオーガニック認証を受けたものにすること、そしてパッケージ材料を全て再生可能またはリサイクル可能なものに置換えることを2025年までの目標としています。これらの取り組みを通じて、持続可能性はもちろんのこと、消費者の健康と社会全体の福祉にも貢献する企業価値の創造を目指して参ります。"
